[
  {
    "kind": "control",
    "stamp_ns": "0",
    "seq": 0,
    "u": 0,
    "valid": true
  },
  {
    "kind": "wheel",
    "stamp_ns": "0",
    "seq": 0,
    "wheel_id": "left",
    "speed_mps": 10,
    "valid": true
  },
  {
    "kind": "control",
    "stamp_ns": "100000000",
    "seq": 1,
    "u": 0,
    "valid": true
  },
  {
    "kind": "wheel",
    "stamp_ns": "100000000",
    "seq": 1,
    "wheel_id": "left",
    "speed_mps": 10,
    "valid": true
  },
  {
    "kind": "control",
    "stamp_ns": "200000000",
    "seq": 2,
    "u": 0,
    "valid": true
  },
  {
    "kind": "wheel",
    "stamp_ns": "200000000",
    "seq": 2,
    "wheel_id": "left",
    "speed_mps": 10,
    "valid": true
  }
]
